{
  "schema_version": "1.0",
  "portfolio_id": "pendle_pt_holding",
  "as_of": "2026-10-10T08:00:00Z",
  "quote_currency": "USD",
  "positions": [
    {
      "chain_id": 1,
      "gross_value_usd": "0",
      "debt_value_usd": "0",
      "net_equity_usd": "0",
      "data_origin": "fictional",
      "position_id": "pt_holding_01",
      "protocol": "pendle",
      "position_type": "pt_holding",
      "market_id": "0x47ad2cd1dd15739a7a035b9d3b7828d916fef77e",
      "asset_symbol": "PT-sUSDE-26NOV2026",
      "quantity": "100000",
      "quantity_unit": "PT_tokens",
      "exit_venue_id": "venue:pendle_pt_susde"
    }
  ],
  "totals": {
    "gross_value_usd": "0",
    "debt_value_usd": "0",
    "net_equity_usd": "0"
  }
}
