{
  "schema_version": "1.0",
  "portfolio_id": "stress_portfolio_01",
  "as_of": "2026-10-10T15:21:47Z",
  "quote_currency": "USD",
  "positions": [
    {
      "chain_id": 1,
      "data_origin": "fictional",
      "position_id": "ethena_susde_01",
      "protocol": "ethena",
      "position_type": "token_holding",
      "market_id": null,
      "asset_symbol": "sUSDe",
      "quantity": "400000",
      "quantity_unit": "sUSDe_shares",
      "gross_value_usd": "500745.20",
      "debt_value_usd": "0.00",
      "net_equity_usd": "500745.20",
      "exit_venue_id": "venue:susde_usdc"
    },
    {
      "chain_id": 1,
      "data_origin": "fictional",
      "position_id": "aave_01",
      "protocol": "aave",
      "position_type": "collateralized_borrow",
      "market_id": "aave-v3-ethereum:0x87870Bca3F3fD6335C3F4ce8392D69350B4fA4E2:emode-11",
      "collateral_asset": "USDe",
      "collateral_quantity": "1000000",
      "debt_asset": "USDC",
      "debt_quantity": "820000",
      "gross_value_usd": "999597.00",
      "debt_value_usd": "819891.02",
      "net_equity_usd": "179705.98",
      "exit_venue_id": "venue:usde_usdc"
    },
    {
      "chain_id": 1,
      "data_origin": "fictional",
      "position_id": "morpho_01",
      "protocol": "morpho",
      "position_type": "collateralized_borrow",
      "market_id": "0x90ef0c5a0dc7c4de4ad4585002d44e9d411d212d2f6258e94948beecf8b4c0d5",
      "collateral_asset": "sUSDe",
      "collateral_quantity": "400000",
      "debt_asset": "PYUSD",
      "debt_quantity": "440626.25",
      "gross_value_usd": "500745.20",
      "debt_value_usd": "440655.77",
      "net_equity_usd": "60089.43",
      "exit_venue_id": "venue:susde_usdc"
    },
    {
      "chain_id": 1,
      "data_origin": "fictional",
      "position_id": "pendle_01",
      "protocol": "pendle",
      "position_type": "pt_holding",
      "market_id": "0x47ad2cd1dd15739a7a035b9d3b7828d916fef77e",
      "asset_symbol": "PT-sUSDe",
      "quantity": "300000",
      "quantity_unit": "PT_tokens",
      "gross_value_usd": "298017.30",
      "debt_value_usd": "0.00",
      "net_equity_usd": "298017.30",
      "exit_venue_id": "venue:pendle_pt_susde"
    },
    {
      "position_id": "lend_susde_01",
      "protocol": "morpho",
      "chain_id": 1,
      "position_type": "lending_supply",
      "market_id": "0x90ef0c5a0dc7c4de4ad4585002d44e9d411d212d2f6258e94948beecf8b4c0d5",
      "asset_symbol": "PYUSD",
      "quantity": "1000000",
      "quantity_unit": "PYUSD",
      "gross_value_usd": "1000067.00",
      "debt_value_usd": "0.00",
      "net_equity_usd": "1000067.00",
      "exit_venue_id": "venue:morpho_susde_pyusd_supply",
      "data_origin": "fictional"
    },
    {
      "position_id": "lend_usde_01",
      "protocol": "morpho",
      "chain_id": 1,
      "position_type": "lending_supply",
      "market_id": "0xd9d2fc090bdbab1804ea960dd6669b62357787e5816f575f14ca4e6d999614bf",
      "asset_symbol": "RLUSD",
      "quantity": "500000",
      "quantity_unit": "RLUSD",
      "gross_value_usd": "500011.00",
      "debt_value_usd": "0.00",
      "net_equity_usd": "500011.00",
      "exit_venue_id": "venue:morpho_usde_rlusd_supply",
      "data_origin": "fictional"
    }
  ],
  "totals": {
    "gross_value_usd": "3799182.70",
    "debt_value_usd": "1260546.79",
    "net_equity_usd": "2538635.91"
  }
}
